<?xml version="1.0" encoding="utf-8"?>

<xs:schema xmlns:xs="http://www.w3.org/2001/XMLSchema">

    <xs:element name="Board">
        <xs:complexType>
            <xs:sequence>
                <xs:element name="Case" maxOccurs="unbounded">
                    <xs:complexType>
                        <xs:sequence>
                            <xs:element name="Name" type="xs:string" minOccurs="0"/>
                            <xs:element name="RequiredCastles" type="xs:integer" minOccurs="0"/>
                        </xs:sequence>
                        <xs:attribute name="id" type="xs:integer" use="required"/>
                        <xs:attribute name="position" type="xs:integer" use="required"/>
                        <xs:attribute name="type" type="xs:string" use="required"/>
                    </xs:complexType>
                </xs:element>
            </xs:sequence>
        </xs:complexType>
    </xs:element>

</xs:schema>